{
  "meta": {
    "verzio": "1.0.0",
    "frissitve": "2026-08-29",
    "megjegyzes": "Per-shop adapterek. Statusz: active=lekerve a futtataskor, blocked=bot-val/JS-renderelt (külön fejfeles böngészőt vagy engedélyt igényel)."
  },
  "ciklus_ora": 8,
  "timeout_sec": 25,
  "user_agent": "RadovinArfigyelo/1.0 (+https://github.com/RobertClaw202604; belső árfigyelő, nem árufeltörés)",
  "shopok": [
    {
      "id": "radovin",
      "nev": "Radovin Borkereskedés",
      "tipus": "sajat",
      "statusz": "active",
      "base_url": "https://radovin.hu",
      "kereso_url": "https://radovin.hu/?s={q}",
      "adapter": "woocommerce",
      "kesleltetes_ms": 600
    },
    {
      "id": "veritas",
      "nev": "Veritas Borkereskedés",
      "tipus": "konkurencia",
      "statusz": "pending",
      "base_url": "https://www.borkereskedes.hu",
      "kereso_url": "https://www.borkereskedes.hu/kereses?kereses_text={q}",
      "adapter": "headless",
      "kesleltetes_ms": 1500,
      "megjegyzes": "ShopRenter + JS-rendelt ár (price-act). A kereső headless-ben sem ad találatot; az árak JS-töltöttek. Külön fejlesztési task (böngésző-automatizálás)."
    },
    {
      "id": "borhalo",
      "nev": "Borháló",
      "tipus": "konkurencia",
      "statusz": "pending",
      "base_url": "https://www.borhalo.hu",
      "kereso_url": "https://www.borhalo.hu/?s={q}",
      "adapter": "html-simon",
      "kesleltetes_ms": 900,
      "megjegyzes": "JS-renderelt; headless + valós selectorok kellenek."
    },
    {
      "id": "italpark",
      "nev": "Italpark",
      "tipus": "konkurencia",
      "statusz": "pending",
      "base_url": "https://www.italpark.hu",
      "kereso_url": "https://www.italpark.hu/kereses?search={q}",
      "adapter": "headless",
      "kesleltetes_ms": 1500,
      "termek_kartya_selector": ".product-card",
      "ar_selector": ".product-price--special, .product-price--regular",
      "megjegyzes": "ShopRenter + robotvédelem; a sima kereső nem hoz találatot headless-ben sem. A márka-kategóriaoldalról (pl. /bodri-bor) pontosan kinyerhető, de ehhez per-márka kategória-URL kell. Külön fejlesztési task."
    },
    {
      "id": "bortarsasag",
      "nev": "Bortársaság",
      "tipus": "konkurencia",
      "statusz": "blocked",
      "base_url": "https://www.bortarsasag.hu",
      "kereso_url": "https://www.bortarsasag.hu/hu/kereso?q={q}",
      "adapter": "headless-kell",
      "kesleltetes_ms": 1200,
      "megjegyzes": "Bot-védett (0 bájt sima GET-re). Headless böngésző + megfelelő engedély kell."
    },
    {
      "id": "benebor",
      "nev": "Benebor",
      "tipus": "konkurencia",
      "statusz": "pending",
      "base_url": "https://beneborshop.hu",
      "kereso_url": "https://beneborshop.hu/?s={q}",
      "adapter": "html-simon",
      "kesleltetes_ms": 900
    },
    {
      "id": "borbaro",
      "nev": "Borbáró",
      "tipus": "konkurencia",
      "statusz": "pending",
      "base_url": "https://www.borbaro.hu",
      "kereso_url": "https://www.borbaro.hu/?s={q}",
      "adapter": "html-simon",
      "kesleltetes_ms": 900
    },
    {
      "id": "winehub",
      "nev": "Winehub",
      "tipus": "konkurencia",
      "statusz": "active",
      "base_url": "https://winehub.hu",
      "adapter": "woocommerce-api",
      "kesleltetes_ms": 0,
      "megjegyzes": "WooCommerce. Teljes katalógus /wp-json/wc/store/products (pontos, headless nélkül). A régi /?s= JSON-LD kereső törékeny lett, ezért katalóguslistás adapterrel megy."
    },
    {
      "id": "borvilag",
      "nev": "Borvilág",
      "tipus": "konkurencia",
      "statusz": "active",
      "base_url": "https://www.borvilag.hu",
      "adapter": "shopify",
      "kesleltetes_ms": 0,
      "megjegyzes": "Shopify. Nyilvános /products.json API, pontos árakkal, headless NÉLKÜL. A teljes katalógus húzva, szigorú matcherrel szelektál."
    },
    {
      "id": "borpiac",
      "nev": "Borpiac",
      "tipus": "konkurencia",
      "statusz": "active",
      "base_url": "https://www.borpiac.hu",
      "adapter": "woocommerce-api",
      "kesleltetes_ms": 0,
      "megjegyzes": "WooCommerce. Nyilvános /wp-json/wc/store/products API, pontos árakkal, headless NÉLKÜL. Teljes katalógus + szigorú matcher."
    }
  ]
}
